<?xml version="1.0" encoding="UTF-8"?>
<resolver:AttributeResolver xmlns:resolver="urn:mace:shibboleth:2.0:resolver" xmlns:xsi="http://www.w3.org/2001/XMLSchema-instance" 
                            xmlns:pc="urn:mace:shibboleth:2.0:resolver:pc" xmlns:ad="urn:mace:shibboleth:2.0:resolver:ad" 
                            xmlns:dc="urn:mace:shibboleth:2.0:resolver:dc" xmlns:enc="urn:mace:shibboleth:2.0:attribute:encoder" 
                            xmlns:sec="urn:mace:shibboleth:2.0:security" 
                            xsi:schemaLocation="urn:mace:shibboleth:2.0:resolver http://shibboleth.net/schema/idp/shibboleth-attribute-resolver.xsd
                                               urn:mace:shibboleth:2.0:resolver:pc http://shibboleth.net/schema/idp/shibboleth-attribute-resolver-pc.xsd
                                               urn:mace:shibboleth:2.0:resolver:ad http://shibboleth.net/schema/idp/shibboleth-attribute-resolver-ad.xsd
                                               urn:mace:shibboleth:2.0:resolver:dc http://shibboleth.net/schema/idp/shibboleth-attribute-resolver-dc.xsd
                                               urn:mace:shibboleth:2.0:attribute:encoder http://shibboleth.net/schema/idp/shibboleth-attribute-encoder.xsd
                                               urn:mace:shibboleth:2.0:security http://shibboleth.net/schema/idp/shibboleth-security.xsd">

    <!-- Attribute Definitions for webflow testing -->

    <resolver:AttributeDefinition id="transientId" xsi:type="ad:TransientId">
        <resolver:AttributeEncoder xsi:type="enc:SAML1StringNameIdentifier" nameFormat="urn:mace:shibboleth:1.0:nameIdentifier"/>
        <resolver:AttributeEncoder xsi:type="enc:SAML2StringNameID" nameFormat="urn:oasis:names:tc:SAML:2.0:nameid-format:transient"/>
    </resolver:AttributeDefinition>
    
    <resolver:AttributeDefinition id="cryptoTransientId" xsi:type="ad:CryptoTransientId" dataSealerRef="shibboleth.DataSealer">
        <resolver:AttributeEncoder xsi:type="enc:SAML1StringNameIdentifier" nameFormat="urn:mace:shibboleth:1.0:nameIdentifier"/>
        <resolver:AttributeEncoder xsi:type="enc:SAML2StringNameID" nameFormat="urn:oasis:names:tc:SAML:2.0:nameid-format:transient"/>
    </resolver:AttributeDefinition>

    <resolver:AttributeDefinition id="Principal" xsi:type="ad:PrincipalName" >
        <resolver:AttributeEncoder xsi:type="enc:SAML1StringNameIdentifier" nameFormat="urn:oasis:names:tc:SAML:1.1:nameid-format:unspecified"/>
        <resolver:AttributeEncoder xsi:type="enc:SAML2StringNameID" nameFormat="urn:oasis:names:tc:SAML:1.1:nameid-format:unspecified"/>
    </resolver:AttributeDefinition>

</resolver:AttributeResolver>
