 <AttributeDefinition 
    xmlns="urn:mace:shibboleth:2.0:resolver"
    xmlns:ad="urn:mace:shibboleth:2.0:resolver:ad"
    xmlns:enc="urn:mace:shibboleth:2.0:attribute:encoder" 
    xmlns:xsi="http://www.w3.org/2001/XMLSchema-instance" 
    dependencyOnly="1"
    xsi:type="ad:Simple" id="simplePopulated" sourceAttributeID="flibble"
    xsi:schemaLocation="urn:mace:shibboleth:2.0:resolver http://shibboleth.net/schema/idp/shibboleth-attribute-resolver.xsd
                        urn:mace:shibboleth:2.0:resolver:pc http://shibboleth.net/schema/idp/shibboleth-attribute-resolver-pc.xsd
                        urn:mace:shibboleth:2.0:resolver:ad http://shibboleth.net/schema/idp/shibboleth-attribute-resolver-ad.xsd
                        urn:mace:shibboleth:2.0:resolver:dc http://shibboleth.net/schema/idp/shibboleth-attribute-resolver-dc.xsd
                        urn:mace:shibboleth:2.0:attribute:encoder http://shibboleth.net/schema/idp/shibboleth-attribute-encoder.xsd
                        urn:mace:shibboleth:2.0:security http://shibboleth.net/schema/idp/shibboleth-security.xsd">
 
    <Dependency ref="dep2"/>
    <Dependency ref="dep1"/>
    <Dependency ref="dep3"/>

    <DisplayName xml:lang="en">NameInEnglish</DisplayName>
    <DisplayName xml:lang="fr">NameEnFrancais</DisplayName>

    <DisplayDescription xml:lang="en">DescInEnglish</DisplayDescription>
    <DisplayDescription xml:lang="ca">DescInCanadian</DisplayDescription>
    
    <DisplayDescription xml:lang="fr">DescEnFrancais</DisplayDescription>

    <AttributeEncoder xsi:type="enc:SAML2String" name="urn:oid:0.9.2342.19200300.100.1.3" friendlyName="mail" />
 </AttributeDefinition>