<resolver:AttributeResolver xmlns:resolver="urn:mace:shibboleth:2.0:resolver"
	xmlns:pc="urn:mace:shibboleth:2.0:resolver:pc" xmlns:ad="urn:mace:shibboleth:2.0:resolver:ad"
	xmlns:dc="urn:mace:shibboleth:2.0:resolver:dc" xmlns:enc="urn:mace:shibboleth:2.0:attribute:encoder"
	xmlns:sec="urn:mace:shibboleth:2.0:security" xmlns:xsi="http://www.w3.org/2001/XMLSchema-instance"
	xsi:schemaLocation="urn:mace:shibboleth:2.0:resolver http://shibboleth.net/schema/idp/shibboleth-attribute-resolver.xsd
                            urn:mace:shibboleth:2.0:resolver:pc http://shibboleth.net/schema/idp/shibboleth-attribute-resolver-pc.xsd
                            urn:mace:shibboleth:2.0:resolver:ad http://shibboleth.net/schema/idp/shibboleth-attribute-resolver-ad.xsd
                            urn:mace:shibboleth:2.0:resolver:dc http://shibboleth.net/schema/idp/shibboleth-attribute-resolver-dc.xsd
                            urn:mace:shibboleth:2.0:attribute:encoder http://shibboleth.net/schema/idp/shibboleth-attribute-encoder.xsd
                            urn:mace:shibboleth:2.0:security http://shibboleth.net/schema/idp/shibboleth-security.xsd">

	<resolver:PrincipalConnector
		xmlns:resolver="urn:mace:shibboleth:2.0:resolver" xsi:type="pc:StoredId"
		id="pc" nameIDFormat="https://example.org/stored"
		storedIdDataConnectorRef="dc" />

	<resolver:DataConnector id="dc" xsi:type="dc:StoredId"
		generatedAttributeID="output" salt="123456789abcdefgh"
		sourceAttributeID="foobar" springResources="/net/shibboleth/idp/attribute/resolver/spring/pc/dataconnector.xml">
		<resolver:Dependency ref="staticAttributes" />
	</resolver:DataConnector>

	<resolver:DataConnector id="staticAttributes"
		xsi:type="dc:Static">
		<dc:Attribute id="foobar">
			<dc:Value>barfoo</dc:Value>
		</dc:Attribute>
	</resolver:DataConnector>

	<resolver:AttributeDefinition id="result"
		xsi:type="ad:Simple" sourceAttributeID="output">
		<resolver:Dependency ref="dc" />
		<resolver:AttributeEncoder xsi:type="enc:SAML2StringNameID" nameFormat="https://example.org/stored" />
	</resolver:AttributeDefinition>
</resolver:AttributeResolver>